{
  "$schema": "./contracts/runtime-compatibility-catalog.schema.json",
  "schemaVersion": 1,
  "lastReviewedAt": "2026-06-13",
  "decisionBoundary": {
    "noAutoPromotionFromDependencyInstall": true,
    "noAutoPromotionFromGenericSkillPath": true,
    "noFormalClaimFromSurfaceMatch": true,
    "formalRuntimeSource": "config/sync.json supportedTargets plus runtimeProfileCatalog/runtimeProjectionLayouts in scripts/meta-kim-sync-config.mjs"
  },
  "tierDefinitions": {
    "runtime_projection": "Meta_Kim has a formal repo projection, runtime profile, projection layout, sync manifest entry, and validation coverage.",
    "dependency_install_target": "A dependency installer can target the product, but Meta_Kim does not own a formal runtime projection for it.",
    "candidate_probe": "External docs or user demand suggest compatibility, but Meta_Kim needs a probe, adapter design, and validation before promotion."
  },
  "surfaceTaxonomy": {
    "instruction_context": "Persistent project or global instructions such as AGENTS.md, rules, steering, memories, or custom instruction files.",
    "skill_workflow": "Portable procedure bundles such as SKILL.md folders, skills, workflows, powers, or equivalent reusable playbooks.",
    "agent_mode": "Named agents, subagents, custom modes, assistants, or role-specific execution contexts.",
    "hook_automation": "Pre/post tool hooks, prompt hooks, lifecycle hooks, file event automation, or workflow automation triggers.",
    "mcp_tooling": "MCP server configuration, MCP tools, or compatible external tool provider wiring.",
    "command_cli": "Slash commands, CLI commands, prompt files, or invokable command templates.",
    "memory_context": "Persistent memory, context retrieval, docs search, or codebase context features.",
    "permission_safety": "Approval, sandbox, tool permission, auto-approve, deny, or file-access restriction controls."
  },
  "promotionRules": {
    "requiredForRuntimeProjection": [
      "sync manifest supported target",
      "runtime profile catalog entry",
      "project and global projection layout",
      "generated target paths",
      "runtime sync tests",
      "install or no-install policy",
      "official docs or local runtime probe evidence"
    ]
  },
  "products": [
    {
      "id": "claude",
      "label": "Claude Code",
      "tier": "runtime_projection",
      "formalProjection": {
        "inSyncManifest": true,
        "hasRuntimeProfile": true,
        "hasProjectionLayout": true,
        "isDefaultTarget": true
      },
      "genericCompatibility": {
        "skillPath": ".claude/skills/{skill-name}/SKILL.md",
        "agentPath": ".claude/agents/{agent}.md",
        "hookConfig": ".claude/settings.json",
        "mcpConfig": ".mcp.json",
        "status": "verified_current"
      },
      "dependencyInstall": {
        "ecc": {
          "support": "native",
          "mode": "claude_plugin",
          "evidenceRef": "config/skills.json skills[id=ecc].claudePlugin"
        }
      },
      "evidence": [
        {
          "type": "local_file",
          "ref": "config/sync.json",
          "claim": "Claude is a supported and default sync target."
        },
        {
          "type": "local_file",
          "ref": "scripts/meta-kim-sync-config.mjs",
          "claim": "Claude has a runtime profile and projection layout."
        }
      ],
      "decision": "Keep as a formal Meta_Kim runtime projection.",
      "nextAction": "Maintain by changing canonical sources and running meta:sync plus meta:check."
    },
    {
      "id": "codex",
      "label": "Codex",
      "tier": "runtime_projection",
      "formalProjection": {
        "inSyncManifest": true,
        "hasRuntimeProfile": true,
        "hasProjectionLayout": true,
        "isDefaultTarget": true
      },
      "genericCompatibility": {
        "skillPath": ".agents/skills/{skill-name}/SKILL.md",
        "agentPath": ".codex/agents/{agent}.toml",
        "hookConfig": ".codex/hooks.json",
        "mcpConfig": "codex/config.toml.example",
        "status": "verified_current"
      },
      "dependencyInstall": {
        "ecc": {
          "support": "native",
          "mode": "home_installer",
          "evidenceRef": "config/skills.json skills[id=ecc].platformSupport.codex"
        }
      },
      "evidence": [
        {
          "type": "local_file",
          "ref": "config/sync.json",
          "claim": "Codex is a supported and default sync target."
        },
        {
          "type": "local_file",
          "ref": "scripts/meta-kim-sync-config.mjs",
          "claim": "Codex has a runtime profile and projection layout."
        }
      ],
      "decision": "Keep as a formal Meta_Kim runtime projection.",
      "nextAction": "Preserve .agents/skills as the project skill root and keep Codex hook validation current."
    },
    {
      "id": "openclaw",
      "label": "OpenClaw",
      "tier": "runtime_projection",
      "formalProjection": {
        "inSyncManifest": true,
        "hasRuntimeProfile": true,
        "hasProjectionLayout": true,
        "isDefaultTarget": true
      },
      "genericCompatibility": {
        "skillPath": "openclaw/skills/{skill-name}/SKILL.md",
        "agentPath": "openclaw/workspaces/{agent}/SOUL.md",
        "hookConfig": "openclaw/openclaw.template.json",
        "mcpConfig": "openclaw/openclaw.template.json",
        "status": "verified_current"
      },
      "dependencyInstall": {
        "ecc": {
          "support": "not_applicable",
          "mode": "not_applicable",
          "evidenceRef": "config/skills.json skills[id=ecc].targets"
        }
      },
      "evidence": [
        {
          "type": "local_file",
          "ref": "config/sync.json",
          "claim": "OpenClaw is a supported and default sync target."
        },
        {
          "type": "local_file",
          "ref": "AGENTS.md",
          "claim": "OpenClaw is a compatible formal projection; stricter tool-denial behavior must be backed by OpenClaw-side strict tests, and can merge only after the evidence passes review."
        },
        {
          "type": "official_docs",
          "ref": "https://docs.openclaw.ai/concepts/agent.md",
          "claim": "OpenClaw workspace bootstrap injects AGENTS.md, SOUL.md, and BOOTSTRAP.md from the active workspace."
        },
        {
          "type": "official_docs",
          "ref": "https://docs.openclaw.ai/automation/hooks.md",
          "claim": "OpenClaw internal hooks cover command/lifecycle automation; blocking/canceling policy belongs to typed plugin hooks."
        }
      ],
      "decision": "Keep as a compatible formal Meta_Kim projection with OpenClaw-native workspace, skill, config, and hook surfaces.",
      "nextAction": "Community PRs that improve OpenClaw behavior are welcome; contributors must include strict OpenClaw self-test evidence, especially for typed plugin tool-denial behavior, and changes can merge only after the evidence passes review."
    },
    {
      "id": "cursor",
      "label": "Cursor",
      "tier": "runtime_projection",
      "formalProjection": {
        "inSyncManifest": true,
        "hasRuntimeProfile": true,
        "hasProjectionLayout": true,
        "isDefaultTarget": true
      },
      "genericCompatibility": {
        "skillPath": ".cursor/skills/{skill-name}/SKILL.md",
        "agentPath": ".cursor/agents/{agent}.md",
        "hookConfig": ".cursor/hooks.json",
        "mcpConfig": ".cursor/mcp.json",
        "status": "verified_current"
      },
      "dependencyInstall": {
        "ecc": {
          "support": "native",
          "mode": "project_installer",
          "evidenceRef": "config/skills.json skills[id=ecc].platformSupport.cursor"
        }
      },
      "evidence": [
        {
          "type": "local_file",
          "ref": "config/sync.json",
          "claim": "Cursor is a supported and default sync target."
        },
        {
          "type": "local_file",
          "ref": "scripts/meta-kim-sync-config.mjs",
          "claim": "Cursor has a runtime profile and projection layout."
        },
        {
          "type": "official_docs",
          "ref": "https://cursor.com/docs/subagents",
          "claim": "Cursor project subagents are markdown files under .cursor/agents with YAML frontmatter."
        },
        {
          "type": "official_docs",
          "ref": "https://cursor.com/docs/hooks",
          "claim": "Cursor hooks include preToolUse/postToolUse and failClosed for security-critical hooks."
        },
        {
          "type": "official_docs",
          "ref": "https://cursor.com/docs/rules",
          "claim": "Cursor project rules use .cursor/rules .mdc files and AGENTS.md guidance."
        }
      ],
      "decision": "Keep as a formal Meta_Kim runtime projection with official subagent/rule/hook/MCP surfaces.",
      "nextAction": "Community PRs that improve Cursor behavior are welcome; contributors must include strict Cursor self-test evidence, especially for native choice-surface claims, and changes can merge only after the evidence passes review."
    },
    {
      "id": "opencode",
      "label": "OpenCode",
      "tier": "dependency_install_target",
      "formalProjection": {
        "inSyncManifest": false,
        "hasRuntimeProfile": false,
        "hasProjectionLayout": false,
        "isDefaultTarget": false
      },
      "genericCompatibility": {
        "skillPath": "~/.opencode/skills/{skill-name}/SKILL.md",
        "agentPath": null,
        "hookConfig": null,
        "mcpConfig": null,
        "status": "partial"
      },
      "dependencyInstall": {
        "ecc": {
          "support": "native",
          "mode": "home_installer",
          "evidenceRef": "config/skills.json skills[id=ecc].platformSupport.opencode"
        }
      },
      "evidence": [
        {
          "type": "local_file",
          "ref": "config/skills.json",